{
  "year": 2026,
  "presentations": {
    "P1": {
      "title": "Website & Digital Presence Fundamentals",
      "theme": "Building Your Online Foundation",
      "totalSlides": 30
    },
    "P2": {
      "title": "Business Operations & Client Management",
      "theme": "Running a Professional Tattoo Business",
      "totalSlides": 28
    },
    "P3": {
      "title": "Marketing & Growth Strategies",
      "theme": "Growing Your Artist Brand",
      "totalSlides": 32
    },
    "P4": {
      "title": "Advanced Business & Scaling",
      "theme": "Building a Sustainable Career",
      "totalSlides": 26
    }
  },
  "quarters": {
    "Q1": {
      "theme": "Foundation & Setup",
      "weeks": [1, 2, 3, 4, 5, 6, 7, 8, 9, 10, 11, 12, 13],
      "primaryPresentations": ["P1", "P2"]
    },
    "Q2": {
      "theme": "Growth & Marketing",
      "weeks": [14, 15, 16, 17, 18, 19, 20, 21, 22, 23, 24, 25, 26],
      "primaryPresentations": ["P3", "P1"]
    },
    "Q3": {
      "theme": "Operations & Optimization",
      "weeks": [27, 28, 29, 30, 31, 32, 33, 34, 35, 36, 37, 38, 39],
      "primaryPresentations": ["P2", "P4"]
    },
    "Q4": {
      "theme": "Scaling & Advanced Topics",
      "weeks": [40, 41, 42, 43, 44, 45, 46, 47, 48, 49, 50, 51, 52],
      "primaryPresentations": ["P4", "P3"]
    }
  },
  "episodeCategories": [
    {
      "id": "website-digital",
      "name": "Website & Digital Presence",
      "description": "Website optimization, SEO, online portfolios"
    },
    {
      "id": "pricing-finance",
      "name": "Pricing & Finance",
      "description": "Pricing strategies, financial management, profitability"
    },
    {
      "id": "client-management",
      "name": "Client Management",
      "description": "Client communication, consultations, retention"
    },
    {
      "id": "social-media",
      "name": "Social Media Marketing",
      "description": "Instagram, TikTok, content strategy"
    },
    {
      "id": "booking-systems",
      "name": "Booking & Scheduling",
      "description": "Online booking, deposit systems, calendar management"
    },
    {
      "id": "branding",
      "name": "Personal Branding",
      "description": "Brand identity, positioning, differentiation"
    },
    {
      "id": "portfolio",
      "name": "Portfolio Development",
      "description": "Photography, curation, presentation"
    },
    {
      "id": "studio-ops",
      "name": "Studio Operations",
      "description": "Studio management, team building, efficiency"
    },
    {
      "id": "legal-compliance",
      "name": "Legal & Compliance",
      "description": "Contracts, insurance, regulations"
    },
    {
      "id": "networking",
      "name": "Networking & Partnerships",
      "description": "Industry connections, collaborations, conventions"
    },
    {
      "id": "customer-experience",
      "name": "Customer Experience",
      "description": "Client journey, retention, referrals"
    },
    {
      "id": "email-newsletter",
      "name": "Email & Newsletter Marketing",
      "description": "Email lists, newsletter strategy, automation"
    },
    {
      "id": "analytics-data",
      "name": "Analytics & Data",
      "description": "Tracking metrics, data-driven decisions, KPIs"
    }
  ],
  "weeks": [
    {
      "week": 1,
      "quarter": "Q1",
      "airDate": "2026-01-05",
      "episodeNumber": 1,
      "title": "Why Your Website Is Losing You Clients",
      "category": "website-digital",
      "presentation": "P1",
      "slides": [1, 5, 7, 9, 12, 14, 16, 18, 20, 24],
      "guestName": "Mike DeVries",
      "guestTitle": "Award-Winning Tattoo Artist & Studio Owner",
      "newsletterTopic": "Website Audit Checklist: 20 Points to Review",
      "meetingFocus": "Website fundamentals: How to review and improve your online presence",
      "keyTopics": [
        "The 7-second first impression rule",
        "Mobile optimization for 80%+ of traffic",
        "Portfolio strategies that convert",
        "Booking funnel optimization"
      ],
      "description": "Mike DeVries reveals critical website mistakes costing artists thousands in lost bookings and how to fix them."
    },
    {
      "week": 2,
      "quarter": "Q1",
      "airDate": "2026-01-12",
      "episodeNumber": 2,
      "title": "Pricing Psychology: Stop Undervaluing Your Work",
      "category": "pricing-finance",
      "presentation": "P2",
      "slides": [3, 8, 12, 15, 19, 22],
      "guestName": "Nikko Hurtado",
      "guestTitle": "World-Renowned Color Realism Artist",
      "newsletterTopic": "The Real Cost of Tattooing: Pricing Calculator",
      "meetingFocus": "Understanding your true costs and setting profitable prices",
      "keyTopics": [
        "How to calculate your hourly rate",
        "Pricing by value vs. time",
        "When to raise your prices",
        "Handling price objections"
      ],
      "description": "Nikko Hurtado breaks down the psychology of pricing and how to price your work for profitability without losing clients."
    },
    {
      "week": 3,
      "quarter": "Q1",
      "airDate": "2026-01-19",
      "episodeNumber": 3,
      "title": "The Perfect Client Consultation Framework",
      "category": "client-management",
      "presentation": "P2",
      "slides": [1, 5, 9, 13, 17, 21, 25],
      "guestName": "Megan Massacre",
      "guestTitle": "TV Personality & Tattoo Artist",
      "newsletterTopic": "Consultation Checklist & Client Intake Form Template",
      "meetingFocus": "Mastering consultations to close more bookings",
      "keyTopics": [
        "Pre-consultation prep work",
        "Questions that qualify clients",
        "Setting expectations early",
        "Converting consultations to bookings"
      ],
      "description": "Megan Massacre shares her proven consultation framework that turns tire-kickers into committed clients."
    },
    {
      "week": 4,
      "quarter": "Q1",
      "airDate": "2026-01-26",
      "episodeNumber": 4,
      "title": "Instagram Algorithm Secrets for Tattoo Artists",
      "category": "social-media",
      "presentation": "P3",
      "slides": [2, 6, 10, 14, 18, 23, 28],
      "guestName": "Ryan Ashley",
      "guestTitle": "Ink Master Winner & Social Media Expert",
      "newsletterTopic": "Instagram Content Calendar Template for Artists",
      "meetingFocus": "Creating content that beats the algorithm",
      "keyTopics": [
        "How the algorithm actually works in 2026",
        "Best posting times and frequency",
        "Reels vs. Posts: what works better",
        "Hashtag strategy that gets reach"
      ],
      "description": "Ryan Ashley reveals the Instagram strategies that helped her build a massive following and consistent client pipeline."
    },
    {
      "week": 5,
      "quarter": "Q1",
      "airDate": "2026-02-02",
      "episodeNumber": 5,
      "title": "Building an Online Booking System That Works",
      "category": "booking-systems",
      "presentation": "P1",
      "slides": [11, 15, 19, 23, 27],
      "guestName": "Paul Timman",
      "guestTitle": "Award-Winning Artist & Tech Innovator",
      "newsletterTopic": "Booking System Comparison: Which Platform Is Right for You?",
      "meetingFocus": "Setting up automated booking and deposit collection",
      "keyTopics": [
        "Choosing the right booking platform",
        "Deposit automation and policies",
        "Calendar management best practices",
        "Reducing no-shows with automation"
      ],
      "description": "Paul Timman shows how the right booking system can save you hours per week and increase your booking rate."
    },
    {
      "week": 6,
      "quarter": "Q1",
      "airDate": "2026-02-09",
      "episodeNumber": 6,
      "title": "Personal Branding: Standing Out in a Crowded Market",
      "category": "branding",
      "presentation": "P3",
      "slides": [1, 7, 11, 16, 20, 25, 30],
      "guestName": "Kat Von D",
      "guestTitle": "Celebrity Tattoo Artist & Brand Builder",
      "newsletterTopic": "Your Brand Identity Workbook: Define Your Unique Position",
      "meetingFocus": "Developing your artist brand and differentiation strategy",
      "keyTopics": [
        "What is a personal brand really?",
        "Finding your unique positioning",
        "Consistency across all platforms",
        "Leveraging your story"
      ],
      "description": "Kat Von D shares how she built one of the most recognizable brands in tattooing and how you can do it too."
    },
    {
      "week": 7,
      "quarter": "Q1",
      "airDate": "2026-02-16",
      "episodeNumber": 7,
      "title": "Portfolio Photography: Making Your Work Shine",
      "category": "portfolio",
      "presentation": "P1",
      "slides": [4, 8, 13, 17, 21, 26],
      "guestName": "Steve Butcher",
      "guestTitle": "Hyper-Realism Master",
      "newsletterTopic": "Complete Guide to Photographing Tattoos for Your Portfolio",
      "meetingFocus": "Photography basics: lighting, angles, and editing",
      "keyTopics": [
        "Camera vs. smartphone: what you need",
        "Lighting setup for tattoo photography",
        "Best angles for different placements",
        "Quick editing tips for social media"
      ],
      "description": "Steve Butcher reveals his photography techniques that make his portfolio stand out from the competition."
    },
    {
      "week": 8,
      "quarter": "Q1",
      "airDate": "2026-02-23",
      "episodeNumber": 8,
      "title": "Financial Management: Profit Like a Business Owner",
      "category": "pricing-finance",
      "presentation": "P2",
      "slides": [2, 6, 11, 14, 18, 23, 27],
      "guestName": "Chris Nunez",
      "guestTitle": "Ink Master Judge & Studio Owner",
      "newsletterTopic": "Artist Financial Tracker: Spreadsheet Template",
      "meetingFocus": "Tracking income, expenses, and building profitability",
      "keyTopics": [
        "Separating personal and business finances",